,Unnamed: 0,Question,Answer,lang,portal,instruction
0,0,Can a fraudster withdraw money from my Aadhaar linked bank account if he knows my Aadhaar number or has my Aadhaar card?,"Just by knowing your Aadhaar number or Aadhaar linked bank account, no one can withdraw money from Aadhaar linked bank account.",english,aadhar,Provide an accurate and concise response to the following question related to aadhar in english.
1,1,"Does linking my bank account, PAN, and other services with Aadhaar make me vulnerable?","No. UIDAI does not have visibility of linking of your Aadhaar with any other services. Concern departments such as bank, income tax etc. do not share any information of Aadhaar number holder neither UIDAI stores any such informations.",english,aadhar,Provide an accurate and concise response to the following question related to aadhar in english.
2,2,"Why am I asked to verify Bank account, Demat account, PAN and various other services with Aadhaar?","Aadhaar verification/authentication is governed by the sections of Aadhaar Act, 2016, under which the use case has been notified by the concerned Ministry/Department for providing services.",english,aadhar,Provide an accurate and concise response to the following question related to aadhar in english.
3,3,There are many agencies that simply accept physical copy of Aadhaar and do not carry out any biometric or OTP authentication or verification. Is this a good practice?,"No, in this connection MeitY has issued detailed instructions to all Government Ministries/Departments vide office memorandum no 10(22)/2017-EG-II(VOL-1) dated 19.06.2023.",english,aadhar,Provide an accurate and concise response to the following question related to aadhar in english.
4,4,I gave my Aadhaar card to a service provider for proving my identity. Can anyone harm me by knowing and misusing my Aadhaar number?,"No. Just, by knowing your Aadhaar number, no one can harm you. To prove your identity, Aadhaar number is verfied/authenticated by agencies through various modes as prescribed under Aadhaar Act, 2016.",english,aadhar,Provide an accurate and concise response to the following question related to aadhar in english.
5,5,"If Aadhaar has to be freely used for proving identity and it is safe to do so, then why has UIDAI advised people not to put up their Aadhaar number in Social Media or public domain?","You use PAN card, debit card, credit card, bank cheques wherever required. But do you put these details openly on internet and social media such as Facebook, Twitter, etc.? Obviously no! You do not put such personal details unnecessarily in public domain so that there is no unwarranted invasion attempt on your privacy. The same logic needs to be applied in case of uses of Aadhaar.",english,aadhar,Provide an accurate and concise response to the following question related to aadhar in english.
6,6,"Recently, UIDAI has issued an advisory asking people not to share their Aadhaar number openly in the public domain especially on Social Media or other public platforms. Does this mean that I should not use Aadhaar freely?","You should use your Aadhaar without any hesitation for proving your identity and doing transactions, just like you use your bank account number, PAN card, debit card, credit card, etc., wherever required. What UIDAI has advised is that Aadhaar card should be freely used for proving identity and doing transactions, but should not be put on public platforms like Twitter, Facebook, etc. People give their debit card or credit card details or cheque (which has bank account number) when they purchase goods, or pay school fee, water, electricity, telephone and other utility bills, etc. Similarly, you can freely use your Aadhaar to establish your identity as and when required without any fear. While using Aadhaar, you should do the same level of due diligence as you do in case of other ID cards – not more, not less.",english,aadhar,Provide an accurate and concise response to the following question related to aadhar in english.
7,7,How do I link PAN with Aadhaar?,"For linking your PAN with Aadhaar, you may visit the website of Income Tax Department and follow the instructions.",english,aadhar,Provide an accurate and concise response to the following question related to aadhar in english.
8,8,What is Aadhaar PVC Card? Is it equivalent to paper based laminated Aadhaar Letter?,"Aadhaar PVC card is PVC based Aadhaar card which can be ordered online by paying nominal charges.
Yes.Aadhaar PVC card is equivalent to paper based Aadhaar letter.",english,aadhar,Provide an accurate and concise response to the following question related to aadhar in english.
9,9,"I applied for Aadhaar earlier but did not get it. So, I re-applied. When will I get my Aadhaar?","If your Aadhaar was generated from the first Enrolment then every attempt to re-enrol will be rejected. DO NOT re-apply. You can retrieve your Aadhaar:
(a) Online using Retrieve EID/UID service available on https://myaadhaar.uidai.gov.in/ (if you have the registered mobile no)
(b) By visiting any enrolment centre
(c) By dialing 1947",english,aadhar,Provide an accurate and concise response to the following question related to aadhar in english.
10,10,I recently updated my Aadhaar. Can you please expedite it? I need it urgently.,Aadhaar update has a fixed process which takes up to 90 days from the date of update request. The update process cannot be altered. You may check the status from https://myaadhaar.uidai.gov.in/CheckAadhaarStatus,english,aadhar,Provide an accurate and concise response to the following question related to aadhar in english.
11,11,"I updated my Aadhaar recently. However, the status still shows 'in process'. When will it get updated?","Aadhaar update takes up to 90 days. If your update request is more than 90 days old, then please dial 1947 (toll free) or write to help@uidai.gov.in for further assistance.",english,aadhar,Provide an accurate and concise response to the following question related to aadhar in english.
12,12,"After I get Enroled, how long will it take to get my Aadhaar letter? And how do I get my Aadhaar letter?",Aadhaar generation may take up to 90 days from the date of enrolment. Aadhaar letter is delivered by ordinary post at the registered address of the Aadhaar Number holder.,english,aadhar,Provide an accurate and concise response to the following question related to aadhar in english.
13,13,What if Aadhaar letter is not delivered to the Aadhaar Number holder?,"If Aadhaar Number holder does not receive Aadhaar letter, he/she should contact UIDAI contact center with his/her Enrolment number or may check Aadhaar status online at https://myaadhaar.uidai.gov.in/CheckAadhaarStatus. Meanwhile Aadhaar Number holder can download e-Aadhaar.
You are also requested to verify the correctness of the address in eAadhaar and update the same accordingly (if required).",english,aadhar,Provide an accurate and concise response to the following question related to aadhar in english.
14,14,What if an Aadhaar Number holder misplaces his Aadhaar number?,"a) Aadhaar number holder can find his Aadhaar number using Aadhaar Service - Retrieve Lost UID/EID available on https://myaadhaar.uidai.gov.in/
b) Aadhaar number holder can call 1947 where our Contact Centre Agent will help him/her in getting his/her EID and the same can be used to download his/her eAadhaar from MyAadhaar Portal - Download Aadhaar
c) Aadhaar number holder can also get his/her Aadhaar number from EID number on IVRS system by calling 1947",english,aadhar,Provide an accurate and concise response to the following question related to aadhar in english.
15,15,Is it compulsory to have registered mobile number to use mAadhaar services?,"No. Anyone with a smartphone can install and use mAadhaar App.Without a registered mobile number, Aadhaar number holder will be able to avail only few services such as Order Aadhaar PVC card, Locate Enrolment Center, Verify Aadhaar, Scanning QR code etc.However registered mobile number is mandatory to create the profile in mAadhaar and use the same as digital identity and avail all other Aadhaar services. The OTP will be sent only to registered mobile for creating the profile in mAadhaar.",english,aadhar,Provide an accurate and concise response to the following question related to aadhar in english.
16,16,Where can mAadhaar be used?,"mAadhaar app can be used anywhere anytime within India. mAadhaar is more than Aadhaar card in a wallet. On one hand the mAadhaar profile is accepted as a valid ID proof and on the other, resident can use the features in the app to share their eKYC or QR code with service providers who sought Aadhaar verification of their customers before providing Aadhaar services.",english,aadhar,Provide an accurate and concise response to the following question related to aadhar in english.
17,17,How resident can create profile on m-Aadhaar App?,"Only someone with an Aadhaar linked to a registered mobile number can create Aadhaar profile in the mAadhaar App. They can register their profile in an App installed in any smartphone. However the OTP will be sent to only their registered mobile. Steps to register Aadhaar profile are given below:

Launch the app.
Tap on the Register Aadhaar tab on the top of main dashboard
Create a 4 digit Pin/Password(memorize this password, as it will be required to access profile)
Provide Valid Aadhaar & enter valid Captcha
Enter Valid OTP and submit
The profile should get registered
The registered tab would now display the registered Aadhaar Name
Tap on My Aadhaar tab on the bottom menu
Enter 4-digit Pin/Password
My Aadhaar Dashboard appears",english,aadhar,Provide an accurate and concise response to the following question related to aadhar in english.
18,18,How resident can view the profile?,"The profile can be viewed by tapping on the profile summary on the top (profile image, name and Aadhaar number on the cyan tab) in the main dashboard.",english,aadhar,Provide an accurate and concise response to the following question related to aadhar in english.
19,19,"Is there any process to update the Aadhaar details through mAadhaar App , such like DOB, Mobile number , address etc. and completer process to be added?","No, the facility to update demographic details such as Name, DoB, Mobile number aren not available in the mAadhaar app. Only address update via document facility is currently available.
However the demographics updates features may be included in future releases.",english,aadhar,Provide an accurate and concise response to the following question related to aadhar in english.
20,20,Is it compulsory to have registered mobile number to use mAadhaar?,"No. Anyone in India with a smartphone can install and use mAadhaar App. Although for creating the Aadhaaar profile in mAadhaar, registered mobile number is required.
Without an Aadhaar registered mobile number resident will be able to avail only a few of the services such as Order Aadhaar PVC card, Locate Enrolment Center, Verify Aadhaar, Scanning QR code etc.",english,aadhar,Provide an accurate and concise response to the following question related to aadhar in english.
21,21,"Is there any process to update the Aadhaar details such as DOB, Mobile number , address etc. through mAadhaar App?","No, mAadhaar app can be used to update address only.",english,aadhar,Provide an accurate and concise response to the following question related to aadhar in english.
22,22,How Date of Birth (DOB) in Aadhaar can be verified ?,DOB in Aadhaar shall be marked as verified when a valid proof of birth document is submitted at the time of enrolment or update. You are requested to ensure that the operator selects 'verified' option for DOB. Only year of birth (YOB) shall be printed on your Aadhaar Letter if the DOB is marked as 'declared' or 'approximate'.,english,aadhar,Provide an accurate and concise response to the following question related to aadhar in english.
23,23,What is the process to be followed for Aadhaar enrolment and what information is to be provided  to get Aadhaar?,"An individual seeking enrolment to visit an Aadhar enrolment centre and submit a request (as specified) alongwith valid supporting documents. The enrolment operator shall capture the following information during the course of enrolment:
Mandatory Demographic information (Name, Date of Birth, Gender, Address)Optional demographic information (mobile number, email)Details of Mother/Father/Legal Guardian (in case of HOF based enrolment)AndBiometric Information (Photo, 10 finger prints, both Iris) After completing the enrolment the operator shall return all the documents alongwith an acknowledgement slip containing the applicable charges.( New Enrolment is Free of charge)List of valid supporting documents is available at List of Supporting DocumentYou can locate the nearest enrolment centre at : Bhuvan Aadhaar Portal",english,aadhar,Provide an accurate and concise response to the following question related to aadhar in english.
24,24,Will getting Aadhaar be compulsory?,"Residents who are eligible for Aadhaar can apply for Aadhaar as per the provisions of the Aadhaar Act and the Regulations framed thereunder. Similarly, agencies providing benefits and services may choose to use Aadhaar in their systems and may require that their beneficiaries or customers provide their Aadhaar for these services.",english,aadhar,Provide an accurate and concise response to the following question related to aadhar in english.
25,25,What are the features and benefits of Aadhaar?,"One Aadhaar: Aadhaar is a unique number, and no resident can have a duplicate number since it is linked to their individual biometrics; thereby identifying fake and ghost identities which result in leakages today. Savings from eliminating duplicates and fakes through Aadhaar-based identification will further enable governments to expand benefits to other eligible residents.Portability: Aadhaar is a universal number, and agencies and services can contact the central Unique Identification database from anywhere in the country to authenticate a beneficiary's identity by availing authentication services.Electronic benefit transfers: The UID-enabled-Bank-Account network will offer a secure and low cost platform to directly remit benefits to residents without the heavy costs associated today with benefit distribution; the leakages in the current system will also be stemmed as a result.Aadhaar-based authentication to confirm entitlement delivered to the beneficiary: The UIDAI will offer online authentication services for agencies who wish to validate a resident's identity; this service will enable confirmation of the entitlement actually reaching the intended beneficiary. Improved services through increased transparency: Clear accountability and transparent monitoring would significantly improve access and quality of entitlements to beneficiaries and the agency alike. Self-service puts residents in control: Using Aadhaar as an authentication mechanism, residents should be able to access up-to-date information about their entitlements, demand services and redress their grievances directly from their mobile phone, kiosks or other means. In the case of self-service on the resident's mobile, security is assured using two-factor authentication (i.e. by proving possession of the resident's registered Mobile Number and knowledge of the resident's Aadhaar PIN). These standards are compliant with the Reserve Bank of India's approved standards for Mobile Banking and Payments.",english,aadhar,Provide an accurate and concise response to the following question related to aadhar in english.
26,26,What is Aadhaar?,Aadhaar number is a 12 digit random number assigned to an individual seeking enrolment on completing the enrolment process. This is digital identity issued to an Aadhaar holder which can be authenticated through biometric or mobile OTP.,english,aadhar,Provide an accurate and concise response to the following question related to aadhar in english.
27,27,How does the UIDAI protect the individual and their information?,"Protection of the individual, and the safeguarding their information is inherent in the design of the UID project. From having a random number which does not reveal anything about the individual to other features listed below, the UID project keeps the interest of the resident at the core of its purpose and objectives. Collecting limited information: Data collected by the UIDAI is purely to issue Aadhaar, and confirm the identity of Aadhaar holders. The UIDAI is collecting basic data fields in order to be able to establish identity this includes Name, Date of Birth, Gender, Address, Parent/ Guardian's name essential for children but not for others, mobile number and email id is optional as well . The UIDAI is collecting biometric information to establish uniqueness therefore collecting photo, 10 finger prints and iris. No profiling and tracking information collected: The UIDAI policy bars it from collecting sensitive personal information such as religion, caste, community, class, ethnicity, income and health. The profiling of individuals is therefore not possible through the UID system, since the data collected is limited to that required for identification and identity confirmation. The UIDAI had in fact, dropped the place of birth data field part of the initial list of information it planned to collect based on feedback from CSOs that it could lead to profiling. The UIDAI also does not collect any transaction records of the individual. The records of an individual confirming their identity through Aadhaar will only reflect that such a confirmation happened. This limited information will be retained for a short period time in the interest of the resident, to resolve any disputes. Release of information - yes or no response: The UIDAI is barred from revealing personal information in Aadhaar database the only response permitted is yes or no to requests to verify an identity The only exceptions are the order of a High court , or the order of a secretary, in case of national security . This is a reasonable exception and is clear and precise. This approach is also in line with security norms followed in US and Europe on access to data in case of a security threat. Data protection and privacy: The UIDAI has the obligation to ensure the security and confidentiality of the data collected . The data will be collected on software provided by the UIDAI and encrypted to prevent leaks in transit. Trained and certified enrollers will collect the information, who will not have access to the data being collected. The UIDAI has a comprehensive security policy to ensure the safety and integrity of its data. It will publish more details on this, including the Information Security Plan and Policies for the CIDR and mechanisms for auditing the compliance of the UIDAI and its contracting agencies. In addition, there will be strict security and storage protocols in place. Penalties for any security violation will be severe, and include penalties for disclosing identity information . There are penal consequences for unauthorised access to CIDR including hacking , and penalties for tampering with data in the CIDR under the Aadhaar Act, 2016 . Convergence and linking of UIDAI information to other databases: The UID database is not linked to any other databases, or to information held in other databases. Its only purpose will be to verify a person's identity at the point of receiving a service, and that too with the consent of Aadhaar holder. The UID database will be guarded both physically and electronically by a few select individuals with high clearance. It will not be available even for many members of the UID staff and will be secured with the best encryption, and in a highly secure data vault. All access details will be properly logged.",english,aadhar,Provide an accurate and concise response to the following question related to aadhar in english.
28,28,What use can Aadhaar be put to?,"Aadhaar can be used to identity beneficiaries for delivery of financial and other subsidies, benefits and services offered by the scheme implementing agencies. Beside this, Aadhaar authentication is allowed in the interest of good governance preventing leakage of public funds, promoting ease of living of residents and enabling better access to services for them.",english,aadhar,Provide an accurate and concise response to the following question related to aadhar in english.
29,29,How is Aadhaar different from any other identity issued by the government?,"Aadhaar is a unique 12 digit random number assigned to a resident which is apart from offline or physical  verification, verifiable online anywhere anytime using the Aadhaar authentication platform. This number, when authenticated successfully, would serve as proof of identity and could be used for identification of beneficiaries for transfer of benefits, subsidies, services and other purposes.",english,aadhar,Provide an accurate and concise response to the following question related to aadhar in english.
30,30,What are the possible criminal penalties envisaged against the fraud or unauthorized access to data?,"Following are the criminal offences and penalties provided in the Aadhaar Act, 2016 (as amended):
1. Impersonation by providing false demographic or biometric information, at the time of enrolment, is an offence – imprisonment up to 3 years or a fine of upto Rs. 10,000/- or with both.
2. Appropriating the identity of an Aadhaar number holder by changing or attempting to change the demographic and biometric information of an Aadhaar number holder is an offence - imprisonment upto 3 years and a fine of upto Rs. 10,000/-.
3. Pretending to be an agency authorized to collect Identity information of a resident is an offence – imprisonment up to 3 years or with a fine of upto Rs. 10,000 for a person, or up to Rs. 1 lakh for a company, or with both.
4. Intentionally transmitting/ disclosing information collected during enrolment/ authentication to an unauthorized person or in contravention of any agreement or arrangement under this Act is an offence – imprisonment upto 3 years or with a fine of            up to Rs. 10,000/- for a person, or of up to Rs. 1 lakh for a company, or with both.
5. Unauthorized access to the central identities data repository (CIDR) and hacking is an offence – imprisonment upto 10 years and a fine of minimum Rs. 10 Lakhs.
6. Tampering with data in the central identities data repository is an offence – imprisonment upto 10 years and a fine up to Rs. 10,000/-.
7. Unauthorized use of identity information of an individual by an requesting entity or Offline Verification Seeking Entity – imprisonment up to 3 years or fine up to Rs.10,000/- in case of a individual, or of upto Rs.1 Lakh in case of a company or with            both.
8. Penalty for an offence, for which no specific penalty is provided elsewhere - imprisonment upto 3 years or fine up to Rs.25,000/- in case of a individual, or of up to Rs.1 Lakh in case of a company or with both.",english,aadhar,Provide an accurate and concise response to the following question related to aadhar in english.
31,31,What are the Data protection and privacy measures taken by UIDAI ?,"The UIDAI ensures the security and confidentiality of the data collected. The enrolment data is collected on client application  provided by the UIDAI, which is encrypted at source and the packet is transmitted in a secure manner. UIDAI has published guidelines in this regard which is available on its website. UIDAI has security policy in place for data security in motion and at rest.
Penalty for unauthorized access to Central Identities Data Repository have been detailed in Aadhaar (Targeted delivery of financial and other subsidies , benefits and services) Act, 2016  - Chapter VII under Offences and Penalties, Section 38.",english,aadhar,Provide an accurate and concise response to the following question related to aadhar in english.
32,32,What are the privacy protections in place to protect the right to privacy of the resident?,"Protection of the individual and the safeguarding their information is inherent in the design of the UID project. From having a random number which does not reveal anything about the individual to other features listed below, the UID project keeps the interest of the resident at the core of its purpose and objectives. 

 Collecting limited informationThe UIDAI is collecting only basic data fields - Name, Date of Birth, Gender, Address, Parent/ Guardian’s (name essential for children but not for others) photo, 10 finger prints and iris scan.
 No profiling and tracking information collectedThe UIDAI policy bars it from collecting sensitive personal information such as religion, caste, community, class, ethnicity, income and health. The profiling of individuals is therefore not possible through the UID system.
 Release of information – yes or no responseThe UIDAI will not reveal personal information in the Aadhaar database – the only response will be a ‘yes’ or ‘no’ to requests to verify an identity
 Convergence and linking of UIDAI information to other databasesThe UID database is not linked to any other databases, or to information held in other databases. Its only purpose will be to verify a person’s identity at the point of receiving a service, and that too with the consent of the aadhaar number holderThe UID database will be guarded both physically and electronically by a few select individuals with high clearance. The data will be secured with the best encryption, and in a highly secure data vault. All access details will be properly logged.",english,aadhar,Provide an accurate and concise response to the following question related to aadhar in english.
