,Unnamed: 0,Question,Answer,lang,portal,instruction
55,55,क्या निवासी विदेशी नागरिकों को जारी किया गया आधार जीवन भर के लिए वैध होगा?,"नहीं, निवासी विदेशी नागरिकों को जारी किया गया आधार निम्नलिखित तक वैध रहेगा:1. वीज़ा/पासपोर्ट की वैधता. 2. ओसीआई कार्ड धारक और नेपाल और भूटान के नागरिकों के मामले में वैधता नामांकन की तारीख से 10 वर्ष होगी।",hindi,aadhar,Provide an accurate and concise response to the following question related to aadhar in hindi.
56,56,निवासी विदेशी राष्ट्रीय नामांकन की प्रक्रिया क्या है?,"नामांकन चाहने वाले निवासी विदेशी नागरिक को नामित आधार नामांकन केंद्र पर जाना होगा और वैध सहायक दस्तावेजों के साथ अपेक्षित नामांकन फॉर्म में अनुरोध जमा करना होगा।
नामांकन ऑपरेटर नामांकन के दौरान निम्नलिखित जानकारी प्राप्त करेगा:
आवासीय स्थिति: (नामांकन आवेदन से ठीक पहले 12 महीनों में 182 दिन या उससे अधिक समय तक भारत में निवास किया हो)अनिवार्य जनसांख्यिकीय जानकारी: (नाम, जन्म तिथि, लिंग, भारतीय पता और ईमेल)वैकल्पिक जनसांख्यिकीय जानकारी: (मोबाइल नंबर)बायोमेट्रिक जानकारी: (फोटो, फिंगर प्रिंट और दोनों आईरिस)
प्रस्तुत दस्तावेज़ों का प्रकार: [वैध विदेशी पासपोर्ट और वैध भारतीय वीज़ा/वैध ओसीआई कार्ड/मान्य एलटीवी पहचान प्रमाण (पीओआई) के रूप में अनिवार्य है] (नेपाल/भूटान के नागरिकों के लिए नेपाल/भूटान का पासपोर्ट। यदि पासपोर्ट उपलब्ध नहीं है, तो) निम्नलिखित दो दस्तावेज़ जमा करने होंगे:(1) वैध नेपाली/भूटानी नागरिकता प्रमाणपत्र (2) 182 दिनों से अधिक के प्रवास के लिए भारत में नेपाली मिशन/रॉयल भूटानी मिशन द्वारा जारी सीमित वैधता फोटो पहचान प्रमाणपत्र।और वैध सहायक दस्तावेजों की सूची में निर्दिष्ट पते का प्रमाण (पीओए)।नामांकन के माध्यम से जमा किए गए विवरण की पुष्टि नामांकन की प्रक्रिया के दौरान संबंधित अधिकारियों से की जा सकती है।",hindi,aadhar,Provide an accurate and concise response to the following question related to aadhar in hindi.
57,57,"मैं निवासी विदेशी नागरिक हूं, क्या मैं आधार के लिए नामांकन कर सकता हूं?","हां, निवासी विदेशी नागरिक जो नामांकन आवेदन से ठीक पहले 12 महीनों में 182 दिनों या उससे अधिक समय तक भारत में रहे थे, वे जनसांख्यिकीय विवरण (वैध दस्तावेजों द्वारा समर्थित) और बायोमेट्रिक्स विवरण जमा करके आधार के लिए नामांकन कर सकते हैं। निवासी विदेशी नागरिक को नामांकन के लिए अपेक्षित फॉर्म में आवेदन करना होगा। नामांकन और अद्यतन फॉर्म 
नामांकन और अद्यतन के लिए वैध सहायक दस्तावेजों की सूची पर उपलब्ध है।",hindi,aadhar,Provide an accurate and concise response to the following question related to aadhar in hindi.
58,58,"जहां किसी व्यक्ति के लिए कई पते के प्रमाण उपलब्ध हैं (उदाहरण के लिए वर्तमान और मूल निवासी), यूआईडीएआई कौन सा प्रमाण स्वीकार करेगा, और वह आधार पत्र कहां भेजेगा?",नामांकन चाहने वाले व्यक्ति के पास यह तय करने का विकल्प होता है कि आधार में कौन सा पता दर्ज किया जाए जिसके लिए वैध पीओए दस्तावेज़ उपलब्ध है। आधार पत्र आधार में पंजीकृत पते पर वितरित किया जाएगा।,hindi,aadhar,Provide an accurate and concise response to the following question related to aadhar in hindi.
59,59,यदि पते के प्रमाण (पीओए) दस्तावेज़ पर दर्शाया गया पता डाक वितरण के लिए अपर्याप्त प्रतीत होता है तो विकल्प क्या है? क्या नामांकन चाहने वाले व्यक्ति से अतिरिक्त जानकारी स्वीकार की जा सकती है?,"हाँ। नामांकन चाहने वाले व्यक्ति को पीओए दस्तावेज़ में उल्लिखित पते पर छोटे फ़ील्ड जोड़ने की अनुमति है, जब तक कि ये परिवर्धन/संशोधन पीओए दस्तावेज़ में उल्लिखित आधार पते में परिवर्तन नहीं करते हैं। यदि आवश्यक परिवर्तन पर्याप्त हैं और आधार पता बदल जाता है, तो सही पते वाला दस्तावेज़ पीओए के रूप में प्रदान किया जाएगा।",hindi,aadhar,Provide an accurate and concise response to the following question related to aadhar in hindi.
60,60,"क्या राशन कार्ड, मनरेगा कार्ड आदि को दस्तावेज़ में सूचीबद्ध परिवार के सदस्यों के लिए पहचान/पते के वैध प्रमाण के रूप में स्वीकार किया जा सकता है, यदि उनके पास अलग-अलग पीओआई या पीओए दस्तावेज़ नहीं हैं?",हाँ। पारिवारिक पात्रता दस्तावेज़ को परिवार के सदस्यों के नामांकन के लिए पहचान/पते के प्रमाण के रूप में तब तक स्वीकार किया जाता है जब तक परिवार के मुखिया और परिवार के सदस्यों की तस्वीर दस्तावेज़ पर स्पष्ट रूप से दिखाई देती है।,hindi,aadhar,Provide an accurate and concise response to the following question related to aadhar in hindi.
61,61,नामांकन चाहने वाले व्यक्ति की यह सुनिश्चित करने में क्या जिम्मेदारियां हैं कि उसका नामांकन अस्वीकार नहीं किया जाए?,"नामांकन चाहने वाले व्यक्ति को निम्नलिखित सुनिश्चित करना चाहिए:1. आधार के लिए नामांकन के लिए पात्रता (नामांकन आवेदन से ठीक पहले 12 महीनों में 182 दिनों या उससे अधिक समय तक भारत में निवास, एनआरआई के लिए लागू नहीं)।2. सुनिश्चित करें कि प्रदान की गई जानकारी सही है और वैध दस्तावेज़ द्वारा समर्थित है।3. नामांकन के लिए वैध सहायक दस्तावेज पीओआई, पीओए, पीओआर और पीडीबी (सत्यापित जन्मतिथि के मामले में) मूल रूप में प्रस्तुत करें।01-10-2023 को या उसके बाद पैदा हुए बच्चे के लिए पीडीबी/पीओआर के रूप में जन्म प्रमाण पत्र अनिवार्य है।4. निर्दिष्ट नामांकन फॉर्म भरें और वैध सहायक दस्तावेजों के साथ ऑपरेटर को जमा करें। नामांकन और अपडेट फॉर्म से भी डाउनलोड किया जा सकता है।5. सुनिश्चित करें कि पावती पर्ची पर हस्ताक्षर करने से पहले आपका जनसांख्यिकीय डेटा (नाम, पता, लिंग और जन्मतिथि) अंग्रेजी और क्षेत्रीय दोनों भाषाओं में नामांकन फॉर्म के अनुसार सही ढंग से दर्ज किया गया है। आप नामांकन पूरा करने से पहले ऑपरेटर से डेटा में सुधार के लिए अनुरोध कर सकते हैं।",hindi,aadhar,Provide an accurate and concise response to the following question related to aadhar in hindi.
62,62,"मेरा आधार अनुरोध अस्वीकार कर दिया गया है, मुझे क्या करना चाहिए?","आधार निर्माण में विभिन्न गुणवत्ता जांच शामिल हैं। इसलिए, ऐसी संभावना है कि आपका आधार अनुरोध गुणवत्ता या किसी अन्य तकनीकी कारण से अस्वीकार कर दिया गया है। यदि आपको एसएमएस प्राप्त हुआ है कि आपका आधार अनुरोध अस्वीकार कर दिया गया है, तो खुद को फिर से नामांकित करने की अनुशंसा की जाती है",hindi,aadhar,Provide an accurate and concise response to the following question related to aadhar in hindi.
63,63,मैंने कई बार आधार के लिए नामांकन कराया है लेकिन मुझे आधार पत्र नहीं मिला है। इस मामले में मुझे क्या करना चाहिए?,"ऐसी संभावना है कि आपका आधार बन गया है लेकिन आपको डाक से आधार पत्र नहीं मिला है। इस मामले में, यह अनुशंसा की जाती है कि आप अपने सभी ईआईडी के लिए, ""नामांकन और अद्यतन स्थिति जांचें"" या https://myaadhaar.uidai.gov.in/CheckAadhaarStatus पर क्लिक करके या निकटतम आधार नामांकन पर जाकर अपने आधार की स्थिति की जांच करवा लें। केंद्र।यदि आपका आधार पहले ही जेनरेट हो चुका है तो आप https://myaadhaar.uidai.gov.in/genricDownloadAadhaar पर जाकर eAadhaar डाउनलोड कर सकते हैं।",hindi,aadhar,Provide an accurate and concise response to the following question related to aadhar in hindi.
64,64,क्या ऑनलाइन डाउनलोड किए गए आधार पत्र की वैधता मूल पत्र के समान ही है?,"हां, ऑनलाइन डाउनलोड किए गए ई-आधार पत्र की वैधता मूल के समान ही है।",hindi,aadhar,Provide an accurate and concise response to the following question related to aadhar in hindi.
65,65,क्या आधार नामांकन के लिए मोबाइल नंबर या ईमेल आईडी प्रदान करना अनिवार्य है?,"नहीं, निवासी भारतीय के आधार नामांकन के लिए मोबाइल नंबर या ईमेल आईडी प्रदान करना अनिवार्य नहीं है (एनआरआई और निवासी विदेशी नागरिकों के लिए ईमेल अनिवार्य है)।लेकिन हमेशा एक मोबाइल नंबर और ईमेल आईडी प्रदान करने की सिफारिश की जाती है ताकि आप अपने आधार आवेदन की स्थिति के बारे में अपडेट प्राप्त कर सकें और ओटीपी-आधारित प्रमाणीकरण के माध्यम से आधार पर आधारित कई सेवाएं प्राप्त कर सकें।",hindi,aadhar,Provide an accurate and concise response to the following question related to aadhar in hindi.
66,66,क्या मैं केवल डाक द्वारा आवश्यक दस्तावेज़ भेजकर आधार के लिए अपना नामांकन करा सकता हूँ?,"नहीं, आपको अपना नामांकन कराने के लिए व्यक्तिगत रूप से आधार नामांकन केंद्र पर जाना होगा क्योंकि आपका बायोमेट्रिक्स लिया जाएगा।",hindi,aadhar,Provide an accurate and concise response to the following question related to aadhar in hindi.
67,67,क्या आधार के लिए नामांकन कराने का कोई ऑनलाइन तरीका है?,"नहीं, आपको अपना नामांकन कराने के लिए व्यक्तिगत रूप से आधार नामांकन केंद्र पर जाना होगा क्योंकि आपका बायोमेट्रिक्स लिया जाएगा।",hindi,aadhar,Provide an accurate and concise response to the following question related to aadhar in hindi.
68,68,क्या नियुक्ति रद्द करने के बाद रिफंड प्रदान किया जाएगा?,"हां, बुक की गई अपॉइंटमेंट रद्द करने पर रिफंड की प्रक्रिया की जाएगी। रिफंड की प्रक्रिया के बाद, राशि आमतौर पर 7-21 दिनों में उपयोगकर्ता के खाते में वापस जमा हो जाती है। यदि यूआईडीएआई एएसके पर बुक की गई सेवा का लाभ नहीं उठाया जाता है तो व्यक्ति/आधार संख्या धारक को अपॉइंटमेंट को फिर से निर्धारित करने की सलाह दी जाती है।",hindi,aadhar,Provide an accurate and concise response to the following question related to aadhar in hindi.
69,69,मैंने अपना आधार खो दिया है और मेरा मोबाइल नंबर भी आधार के साथ पंजीकृत नहीं है। क्या मैं इसे ASK पर प्राप्त कर सकता हूँ?,"हाँ। आप अपना आधार डाउनलोड करने और प्रिंटआउट प्राप्त करने के लिए यूआईडीएआई द्वारा संचालित किसी भी आधार सेवा केंद्र पर जा सकते हैं। ASK पर आपको अपना आधार नंबर देना होगा। यह सेवा बैंकों, डाकघरों, बीएसएनएल, केंद्र या राज्य सरकार के कार्यालयों में आधार नामांकन केंद्र पर भी उपलब्ध है।",hindi,aadhar,Provide an accurate and concise response to the following question related to aadhar in hindi.
70,70,मुझे अपना आधार कार्ड नहीं मिला। क्या मैं इसे आधार नामांकन केंद्र से प्राप्त कर सकता हूं?,"आप अपना आधार खुद myAadhaar पोर्टल से डाउनलोड कर सकते हैं. इसके लिए आपके पास आधार के साथ पंजीकृत एक मोबाइल नंबर होना चाहिए।यदि आपका मोबाइल नंबर आधार के साथ पंजीकृत नहीं है या आप ऑनलाइन सेवा का उपयोग नहीं करना चाहते हैं, तो आप आधार नामांकन केंद्र पर 30/- रुपये के शुल्क  पर उपलब्ध आधार डाउनलोड और रंगीन प्रिंट सेवा का उपयोग कर सकते हैं।  बायोमेट्रिक प्रमाणीकरण के लिए आधार धारक की भौतिक उपस्थिति आवश्यक है। इसके अलावा, आप यूआईडीएआई की वेबसाइट से भी आधार पीवीसी कार्ड ऑर्डर कर सकते हैं।",hindi,aadhar,Provide an accurate and concise response to the following question related to aadhar in hindi.
71,71,दिव्यांगों और बिना उंगलियों के निशान वाले या छतिग्रस्त हाथों वाले लोगों जैसे बीड़ी श्रमिक या बिना उंगलियों वाले लोगों का बायोमेट्रिक कैसे लिया जाएगा?,"आधार में एक समावेशी दृष्टिकोण है और इसकी नामांकन/अद्यतन प्रक्रियाएं विकलांग व्यक्तियों सहित सभी के लिए सुलभ हैं। आधार (नामांकन और अद्यतन) विनियम, 2016 का विनियम 6 बायोमेट्रिक अपवाद वाले निवासियों के नामांकन का प्रावधान करता है, जो अन्य बातों के साथ-साथ यह निर्धारित करता है:
1. नामांकन चाहने वाले ऐसे व्यक्ति जो चोट, विकृति, उंगलियों/हाथों के विच्छेदन या किसी अन्य प्रासंगिक कारण के कारण उंगलियों के निशान प्रदान करने में असमर्थ हैं, ऐसे निवासियों के केवल आईरिस स्कैन एकत्र किए जाएंगे।2. नामांकन चाहने वाले व्यक्तियों के लिए जो इन विनियमों द्वारा अपेक्षित कोई बायोमेट्रिक जानकारी प्रदान करने में असमर्थ हैं, प्राधिकरण नामांकन और अद्यतन सॉफ़्टवेयर में ऐसे अपवादों से निपटने के लिए प्रदान करेगा, और ऐसा नामांकन निर्दिष्ट प्रक्रिया के अनुसार किया जाएगा। इस प्रयोजन के लिए प्राधिकरण द्वारा.आप निम्नलिखित लिंक पर उपलब्ध बायोमेट्रिक अपवाद नामांकन दिशानिर्देश भी देख सकते हैं -https://uidai.gov.in/images/Biometric_exception_guidelines_01-08-2014.pdf""",hindi,aadhar,Provide an accurate and concise response to the following question related to aadhar in hindi.
72,72,मैं आधार के लिए कहां नामांकन कर सकता हूं?,आधार नामांकन के लिए आप किसी भी आधार नामांकन केंद्र पर जाकर नामांकन करा सकते हैं। जिसे निम्नलिखित मानदंडों द्वारा पाया जा सकता है:क. सभी नामांकन (18+ सहित) और अद्यतनख. सभी नामांकन (18+ को छोड़कर) और अद्यतनग. केवल बच्चों का नामांकन एवं मोबाइल अपडेटघ. केवल बच्चों का नामांकनआधार नामांकन केंद्रों के नेविगेशन और पते के साथ विस्तृत सूची भुवन पोर्टल: भुवन आधार पोर्टल पर उपलब्ध है।,hindi,aadhar,Provide an accurate and concise response to the following question related to aadhar in hindi.
