,Unnamed: 0,Question,Answer,lang,portal,instruction
274,274,विंडोज़ क्यूआर कोड स्कैनर और यूआईडीएआई एप्लिकेशन किस प्रकार काम करते हैं?,"यूआईडीएआई के क्यूआर कोड रीडर एप्लिकेशन की संस्थापना के उपरांत, ई-आधार के सुरक्षित क्यूआर कोड को यूआईडीएआई विनिर्देशों के अनुसार वास्तविक स्कैनर के उपयोग से स्कैन करना होगा। विंडोज़ क्यूआर कोड स्कैनर के उपयोग से क्यूआर कोड स्कैनर के उपयोग द्वारा क्यूआर कोड डिजिटल रूप से सत्यापित करने के बाद एप्लिकेशन निवासी की जनसांख्यिकीय जानकारी प्रदर्शित करेगी।",hindi,aadhar,Provide an accurate and concise response to the following question related to aadhar in hindi.
275,275,सुरक्षित क्यूआर कोड का उपयोग कौन कर सकता है? ,"कोई भी आधार धारक या कोई भी उपयोगकर्ता/सेवा एजेंसी जैसे बैंक, एयूए, केयूए, होटल आदि आधार में डेटा के ऑफ़लाइन सत्यापन के लिए इस सुविधा का उपयोग कर सकते हैं।",hindi,aadhar,Provide an accurate and concise response to the following question related to aadhar in hindi.
276,276,बायोमेट्रिक लॉकिंग क्या है?,"बायोमेट्रिक लॉकिंग/अनलॉकिंग एक ऐसी सेवा है, जो आधार धारक को अपने बायोमेट्रिक्स को लॉक करने और अस्थायी रूप से खोलने की अनुमति प्रदान करती है। इस सुविधा का उद्देश्य निवासी के बायोमेट्रिक्स डेटा की निजता और गोपनीयता को मजबूत बनाना है।",hindi,aadhar,Provide an accurate and concise response to the following question related to aadhar in hindi.
277,277,बायोमेट्रिक्स को अनलॉक (लॉक) कैसे करें?,"एक बार किसी निवासी बायोमेट्रिक लॉकिंग सिस्टम के सक्षम कर लेने पर उसका बायोमेट्रिक तब तक लॉक रहता है जब तक कि आधार धारक नीचे दिए गए किसी विकल्प को नहीं चुन लेता:
इसे अनलॉक करना (जो अस्थायी है) यालॉकिंग सिस्टम को अक्षम करना
बायोमेट्रिक अनलॉक निवासी द्वारा एम-आधार के जरिए, यूआईडीएआई की वेबसाइट, नामांकन केंद्र, आधार सेवा केंद्र (एएसके) पर जाकर किया जा सकता है।
नोट: इस सेवा का लाभ लेने के लिए पंजीकृत मोबाइल नंबर आवश्यक है। यदि आपका मोबाइल नंबर आधार के साथ पंजीकृत नहीं है तो, कृपया नजदीकी नामांकन केंद्र/मोबाइल अपडेट केंद्र पर जाएं।",hindi,aadhar,Provide an accurate and concise response to the following question related to aadhar in hindi.
278,278,बायोमेट्रिक लॉक होने पर क्या होता है?,"लॉक्ड बायोमेट्रिक्स पुष्टि करता है कि आधार धारक प्रमाणीकरण के लिए बायोमेट्रिक्स (फिंगरप्रिंट/आईरिस/फेस) का उपयोग नहीं कर सकेगा, यह किसी भी प्रकार के बायोमेट्रिक प्रमाणीकरण को रोकने के लिए एक सुरक्षा सुविधा है।इससे यह भी सुनिश्चित होता है कि कोई भी संस्था किसी भी माध्यम से उक्त आधार धारक के संबंध में बायोमेट्रिक आधारित आधार प्रमाणीकरण नहीं कर सकती है।",hindi,aadhar,Provide an accurate and concise response to the following question related to aadhar in hindi.
279,279,क्या सभी बायोमेट्रिक डेटा को लॉक किया जा सकता है?,"बायोमेट्रिक तरीकों के रूप में फिंगरप्रिंट, आईरिस और चेहरे को लॉक कर दिया जाएगा और बायोमेट्रिक लॉकिंग के उपरांत, आधार धारक बायोमेट्रिक के उपर्युक्त तरीकों के उपयोग द्वारा  आधार प्रमाणीकरण नहीं कर सकेगा।",hindi,aadhar,Provide an accurate and concise response to the following question related to aadhar in hindi.
280,280,"""बायोमेट्रिक्स को कौन और कब लॉक करेगा?","जिन आधार नंबर धारकों के पास पंजीकृत मोबाइल नंबर हैं, वे अपने बायोमेट्रिक्स को लॉक कर सकते हैं। इस सुविधा का उद्देश्य निवासियों के बायोमेट्रिक्स डेटा की निजता और गोपनीयता को सुदृढ़ करना है।
बायोमेट्रिक्स को लॉक करने के उपरांत यदि बायोमेट्रिक रीति (फिंगरप्रिंट/आईरिस/फेस) के उपयोग द्वारा किसी भी प्रमाणीकरण सेवाओं को लागू करने के लिए यूआईडी का उपयोग किए जाने पर बायोमेट्रिक्स लॉक होने संबंधी संकेत, एक विशिष्ट त्रुटि कोड '330' प्रदर्शित होगा और संस्था बायोमेट्रिक प्रमाणीकरण करने में समर्थ नहीं होगी।""",hindi,aadhar,Provide an accurate and concise response to the following question related to aadhar in hindi.
281,281,आधार पेपरलेस ऑफ़लाइन ई-केवाईसी क्या है? ,"यह एक सुरक्षित साझा करने योग्य दस्तावेज है जिसका उपयोग कोई भी आधार नंबर धारक, पहचान के ऑफ़लाइन सत्यापन के लिए कर सकता है।
इस सुविधा का उपयोग करने के इच्छुक निवासी को यूआईडीएआई वेबसाइट पर जाकर अपना डिजिटल हस्ताक्षरित ऑफ़लाइन एक्सएमएल तैयार करना होगा। ऑफ़लाइन एक्सएमएल में नाम, पता, फोटो, लिंग, जन्मतिथि, पंजीकृत मोबाइल नंबर का हैश, पंजीकृत ईमेल पते का हैश और आधार नंबर के अंतिम 4 अंक और उसके बाद समय विवरण सहित संदर्भ आईडी शामिल होगा। यह सेवा प्रदाताओं/ऑफ़लाइन सत्यापन मांगकर्ता संस्था (ओवीएसई) को आधार नंबर एकत्र या संग्रह करने की आवश्यकता के बिना ऑफ़लाइन आधार सत्यापन सुविधा प्रदान करेगी।""",hindi,aadhar,Provide an accurate and concise response to the following question related to aadhar in hindi.
282,282,ऑफ़लाइन आधार एक्सएमएल कैसे सृजित करें?,"आधार ऑफलाइन ई-केवाईसी सृजित करने की प्रक्रिया नीचे दी गई है:
• यूआरएल https://myaadhaar.uidai.gov.in/offline-ekyc पर जाएं• 'आधार नंबर' या 'वीआईडी' दर्ज करें और स्क्रीन में उल्लिखित 'सुरक्षा कोड' दर्ज करें, फिर 'ओटीपी भेजें' पर क्लिक करें। दिए गए आधार नंबर या वीआईडी के लिए पंजीकृत मोबाइल नंबर पर ओटीपी भेजा जाएगा। यूआईडीएआई की एम-आधार मोबाइल एप्लिकेशन पर ओटीपी उपलब्ध होगा। प्राप्त ओटीपी दर्ज करें। एक शेयर कोड दर्ज करें जो ज़िप फ़ाइल का पासवर्ड हो और 'डाउनलोड' बटन पर क्लिक करें• डिजिटल रूप से हस्ताक्षरित एक्सएमएल वाली ज़िप फ़ाइल उस डिवाइस पर डाउनलोड की जाएगी जिसमें ऊपर उल्लिखित चरण निष्पादित किए गए हैं।
ऑफ़लाइन आधार एक्सएमएल को एम-आधार ऐप से भी डाउनलोड किया जा सकता है।",hindi,aadhar,Provide an accurate and concise response to the following question related to aadhar in hindi.
283,283,इस आधार पेपरलेस ऑफलाइन ई-केवाईसी के उपयोगकर्ता कौन हैं?,"कोई भी आधार नंबर धारक, जो यूआईडीएआई वेबसाइट से डाउनलोड किए गए डिजिटल हस्ताक्षरित एक्सएमएल का उपयोग करके किसी भी सेवा प्रदाता (ओवीएसई) के साथ अपनी पहचान स्थापित करना चाहता है, वह इस सेवा का उपयोगकर्ता हो सकता है। सेवा प्रदाता के पास अपनी सुविधा पर यह आधार पेपरलेस ऑफ़लाइन ई-केवाईसी प्रदान करने और ऑफ़लाइन सत्यापन करने का प्रावधान होना चाहिए।",hindi,aadhar,Provide an accurate and concise response to the following question related to aadhar in hindi.
284,284,इस पेपरलेस ऑफ़लाइन ईकेवाईसी दस्तावेज़ को सेवा प्रदाता के साथ कैसे साझा करें? ,निवासी अपनी पारस्परिक सुविधा के अनुसार सेवा प्रदाता को शेयर कोड के साथ एक्सएमएल ज़िप फ़ाइल साझा कर सकते हैं।,hindi,aadhar,Provide an accurate and concise response to the following question related to aadhar in hindi.
285,285,सेवा प्रदाता किस प्रकार आधार ऑफ़लाइन ई-केवाईसी का उपयोग करेंगे?,"सेवा प्रदाता द्वारा आधार ऑफ़लाइन ई-केवाईसी सत्यापन की प्रक्रिया इस प्रकार है:
सेवा प्रदाता ज़िप फ़ाइल प्राप्त करने पर वह निवासी द्वारा प्रदान किए गए पासवर्ड (शेयर कोड) का उपयोग करके एक्सएमएल फ़ाइल प्राप्त कर लेता है।एक्सएमएल फ़ाइल में नाम, जन्मतिथि, लिंग और पता जैसे जनसांख्यिकीय विवरण होंगे। फोटो 64 एन्कोडेड आधारित प्रारूप में है जिसे किसी भी यूटिलिटी या प्लेन एचटीएमएल पृष्ठ का उपयोग करके सीधे प्रस्तुत किया जा सकता है। ईमेल पता और मोबाइल नंबर हैश किए गए हैं।
सेवा प्रदाता को निवासियों से ईमेल पता और मोबाइल नंबर एकत्र करना होगा और हैश को विधिमान्य करने के लिए निम्नलिखित कार्य करने होंगे:
मोबाइल नंबर:
हैशिंग लॉजिक: Sha256(Sha256(मोबाइल+शेयरकोड))*आधार नंबर के अंतिम अंक की संख्या
उदाहरण :मोबाइल नंबर: 9800000002आधार नंबर: 123412341234शेयर कोड: Abc@123Sha256(Sha256(9800000002+ Abc@123))*4यदि आधार नंबर शून्य या 1 (123412341230/1) पर समाप्त होती है तो इसे एक बार हैश किया जाएगा।Sha256(Sha256(9800000002+ Abc@123))*1
ईमेल पता:
हैशिंग लॉजिक: यह बिना किसी तर्क के ईमेल का एक सरल SHA256 हैश है
संपूर्ण एक्सएमएल डिजिटल रूप से हस्ताक्षरित है और सेवा प्रदाता यूआईडीएआई की वेबसाइट (https://uidai.gov.in/images/uidai_offline_publickey_26022019.cer ) पर उपलब्ध हस्ताक्षर और सार्वजनिक कुंजी के उपयोग द्वारा एक्सएमएल फ़ाइल को मान्य कर सकता है।",hindi,aadhar,Provide an accurate and concise response to the following question related to aadhar in hindi.
286,286,क्या इस ऑफ़लाइन पेपरलेस ई-केवाईसी दस्तावेज़ को सेवा प्रदाता द्वारा अन्य संस्थाओं के साथ साझा किया जा सकता है?,"सेवा प्रदाता एक्सएमएल या शेयर कोड अथवा इसकी विषय-वस्तु को किसी अन्य के साथ साझा, प्रकाशित या प्रदर्शित नहीं करेंगे। इन कार्यों के किसी भी अपालन पर आधार अधिनियम, 2016 (संशोधित) की धारा 29(2), 29 (3), 29(4) और 37 तथा आधार (अधिप्रमाणन और ऑफ़लाइन सत्यापन) विनियम, 2021 के विनियम 25 के उप विनियम 1क, विनियम 14क और आधार (सूचना की सहभाजिता) विनियम, 2016 के विनियम 6 और 7 के तहत कार्रवाई की जाएगी।""",hindi,aadhar,Provide an accurate and concise response to the following question related to aadhar in hindi.
287,287,यह आधार ऑफ़लाइन पेपरलेस ई-केवाईसी दस्तावेज़ निवासियों द्वारा ऑफ़लाइन प्रस्तुत अन्य पहचान दस्तावेजों से किस प्रकार भिन्न है? ,"सेवा प्रदाता को पैन कार्ड, पासपोर्ट आदि जैसे पहचान दस्तावेज प्रदान करके पहचान सत्यापन आसानी से पूरा किया जा सकता है। हालाँकि, पहचान के लिए उपयोग किए जा रहे ये सभी दस्तावेज़,  अभी भी जाली और नकली हो सकते हैं  तथा इनका तुरंत ऑफ़लाइन सत्यापित करना संभव हो भी सकता है और नहीं भी। दस्तावेज़ सत्यापनकर्ता के पास दस्तावेज़ या उसमें मौजूद जानकारी की प्रामाणिकता को सत्यापित करने के लिए कोई तकनीकी साधन नहीं है और उसे दस्तावेज़ जारीकर्ता  पर भरोसा करना पड़ता है। जबकि, आधार पेपरलेस ऑफलाइन ई-केवाईसी के उपयोग से आधार नंबर धारक द्वारा सृजित एक्सएमएल फ़ाइल,  यूआईडीएआई के डिजिटल हस्ताक्षर के जरिए डिजिटल रूप से हस्ताक्षरित दस्तावेज़ है। इस प्रकार, सेवा प्रदाता फ़ाइल की जनसांख्यिकीय विषय-वस्तु को सत्यापित कर सकता है और ऑफ़लाइन सत्यापन करते समय इसे प्रमाणित कर सकता है।",hindi,aadhar,Provide an accurate and concise response to the following question related to aadhar in hindi.
288,288,मैं डिजिटल हस्ताक्षर सत्यापन के लिए सार्वजनिक प्रमाणपत्र कहाँ से प्राप्त कर सकता हूँ? ,डिजिटल हस्ताक्षर सत्यापन के लिए सार्वजनिक प्रमाणपत्र यहाँ से डाउनलोड किया जा सकता है।,hindi,aadhar,Provide an accurate and concise response to the following question related to aadhar in hindi.
289,289,एडब्ल्यूबी नंबर क्या है?,एयरवे बिल नंबर वह ट्रैकिंग नंबर है जो डीओपी यानी इंडिया स्पीड पोस्ट द्वारा उनके द्वारा वितरित किए जाने वाले असाइनमेंट/उत्पाद के लिए तैयार किया जाता है।'',hindi,aadhar,Provide an accurate and concise response to the following question related to aadhar in hindi.
290,290,"""ऑर्डर आधार पीवीसी कार्ड"" सेवा क्या है?","""आधार पीवीसी कार्ड ऑर्डर करें"" यूआईडीएआई द्वारा शुरू की गई एक ऑनलाइन सेवा है जो आधार धारक को नाममात्र शुल्क का भुगतान करके अपने आधार विवरण को पीवीसी कार्ड पर मुद्रित करने की सुविधा प्रदान करती है।",hindi,aadhar,Provide an accurate and concise response to the following question related to aadhar in hindi.
291,291,"""सफल अनुरोध करने के बाद ""आधार पीवीसी कार्ड"" प्राप्त करने में कितने दिन लगेंगे?",आधार पीवीसी कार्ड के लिए निवासी द्वारा ऑर्डर प्राप्त करने के बाद यूआईडीएआई 5 कार्य दिवस (अनुरोध की तारीख को छोड़कर) के भीतर मुद्रित आधार कार्ड डाक विभाग (डीओपी) को सौंप देता है। डाक विभाग के वितरण मानदंडों के अनुरूप भारतीय डाक की स्पीड पोस्ट सेवा का उपयोग करके आधार पीवीसी कार्ड को आधार डेटाबेस में उनके पंजीकृत पते पर निवासियों को वितरित किया जाता है। निवासी https://www.indiapost.gov.in/_layouts/15/dop.portal.tracking/ trackconsignment.aspx पर डीओपी स्टेटस ट्रैक सेवाओं का उपयोग करके डिलीवरी स्थिति की जांच कर सकते हैं।,hindi,aadhar,Provide an accurate and concise response to the following question related to aadhar in hindi.
292,292,क्या होगा यदि निवासी अपने इच्छित विवरण के साथ आधार पीवीसी कार्ड मुद्रित करवाना चाहते हैं?,"यदि निवासी मुद्रित आधार पत्र या पीवीसी कार्ड के विवरण में कुछ बदलाव चाहते हैं, तो उन्हें पहले स्थायी नामांकन केंद्र या एसएसयूपी पोर्टल (अपडेट के आधार पर) पर जाकर अपना आधार अपडेट करना होगा और फिर इसके लिए अनुरोध करना होगा क्योंकि इस सुविधा का उपयोग आधार पीवीसी कार्ड/पत्र की हार्ड कॉपी प्राप्त करने के लिए किया जा सकता है।""",hindi,aadhar,Provide an accurate and concise response to the following question related to aadhar in hindi.
293,293,एसआरएन क्या है?,एसआरएन 14 अंकीय सेवा अनुरोध संख्या है जो हमारी वेबसाइट पर आधार कार्ड के लिए अनुरोध करने के बाद सृजित होती है। यह प्रत्येक बार अनुरोध करने पर सृजित होगी भले ही भुगतान सफल हो या नहीं।,hindi,aadhar,Provide an accurate and concise response to the following question related to aadhar in hindi.
